{
  "schema_version": "2.0.0",
  "evidence_package_id": "evidence-example-education",
  "scope_id": "scope-example-education",
  "context_id": "context-example-education",
  "protocol_id": "protocol-example-education",
  "brand": "示例教育",
  "foundation": {
    "wiki": {"value": false, "evidence_ids": ["src-industry-report"]},
    "official_site_structured": {"value": true, "evidence_ids": ["src-official-home"]},
    "third_party_count": {"value": 3, "evidence_ids": ["src-industry-report"]},
    "knowledge_graph": {"value": null, "evidence_ids": []},
    "content_active": {"value": true, "evidence_ids": ["src-official-home"]}
  },
  "observations": [
    {
      "observation_id": "obs-chatgpt-brand",
      "query_id": "q-brand-direct",
      "source_type": "user_provided_observation",
      "status": "observed",
      "engine": {"name": "ChatGPT", "model": null, "web_enabled": null},
      "observed_at": "2026-08-20T16:00:00+08:00",
      "raw_response": "示例回答：品牌被明确介绍",
      "position": "top1",
      "recommendation": "explicit",
      "citations": [{"url": "https://example.com", "domain": "example.com", "source_type": "official", "brand_owned": true, "verification_status": "verified"}],
      "sentiment": "positive",
      "coverage": {"intro": true, "selling_points": true, "products": true, "pricing": false, "reputation": null, "news": false},
      "fact_errors": []
    },
    {
      "observation_id": "obs-chatgpt-category",
      "query_id": "q-category-recommendation",
      "source_type": "user_provided_observation",
      "status": "observed",
      "engine": {"name": "ChatGPT", "model": null, "web_enabled": null},
      "observed_at": "2026-08-20T16:01:00+08:00",
      "raw_response": "示例回答：品牌在前三候选中",
      "position": "top3",
      "recommendation": "tied",
      "citations": [],
      "sentiment": "positive",
      "coverage": {"intro": true, "selling_points": true, "products": true, "pricing": null, "reputation": null, "news": null},
      "fact_errors": []
    },
    {
      "observation_id": "obs-chatgpt-solution",
      "query_id": "q-solution",
      "source_type": "user_provided_observation",
      "status": "observed",
      "engine": {"name": "ChatGPT", "model": null, "web_enabled": null},
      "observed_at": "2026-08-20T16:02:00+08:00",
      "raw_response": "示例回答：方案中附带提及品牌",
      "position": "mention",
      "recommendation": "neutral",
      "citations": [{"url": "https://example.org/report", "domain": "example.org", "source_type": "authoritative", "brand_owned": false, "verification_status": "partially_verified"}],
      "sentiment": "neutral",
      "coverage": {"intro": true, "selling_points": false, "products": true, "pricing": null, "reputation": null, "news": null},
      "fact_errors": []
    },
    {
      "observation_id": "obs-chatgpt-comparison",
      "query_id": "q-brand-comparison",
      "source_type": "user_provided_observation",
      "status": "observed",
      "engine": {"name": "ChatGPT", "model": null, "web_enabled": null},
      "observed_at": "2026-08-20T16:03:00+08:00",
      "raw_response": "示例回答：品牌与竞品并列比较",
      "position": "top1_tied",
      "recommendation": "tied",
      "citations": [{"url": "https://example.com/product", "domain": "example.com", "source_type": "official", "brand_owned": true, "verification_status": "verified"}],
      "sentiment": "positive",
      "coverage": {"intro": true, "selling_points": true, "products": true, "pricing": false, "reputation": null, "news": null},
      "fact_errors": []
    },
    {
      "observation_id": "obs-deepseek-brand",
      "query_id": "q-brand-direct",
      "source_type": "direct_engine_observation",
      "status": "observed",
      "engine": {"name": "DeepSeek", "model": null, "web_enabled": false},
      "observed_at": "2026-08-20T16:10:00+08:00",
      "raw_response": "示例回答：品牌获得客观介绍",
      "position": "top1",
      "recommendation": "neutral",
      "citations": null,
      "sentiment": "neutral",
      "coverage": {"intro": true, "selling_points": true, "products": true, "pricing": null, "reputation": null, "news": null},
      "fact_errors": []
    },
    {
      "observation_id": "obs-deepseek-category",
      "query_id": "q-category-recommendation",
      "source_type": "direct_engine_observation",
      "status": "observed",
      "engine": {"name": "DeepSeek", "model": null, "web_enabled": false},
      "observed_at": "2026-08-20T16:11:00+08:00",
      "raw_response": "示例回答：品类推荐中没有出现品牌",
      "position": "absent",
      "recommendation": null,
      "citations": [],
      "sentiment": null,
      "coverage": {"intro": false, "selling_points": false, "products": false, "pricing": false, "reputation": false, "news": false},
      "fact_errors": []
    },
    {
      "observation_id": "obs-deepseek-solution",
      "query_id": "q-solution",
      "source_type": "direct_engine_observation",
      "status": "observed",
      "engine": {"name": "DeepSeek", "model": null, "web_enabled": false},
      "observed_at": "2026-08-20T16:12:00+08:00",
      "raw_response": "示例回答：解决方案中提及品牌",
      "position": "top5",
      "recommendation": "neutral",
      "citations": null,
      "sentiment": "neutral",
      "coverage": {"intro": true, "selling_points": false, "products": true, "pricing": null, "reputation": null, "news": null},
      "fact_errors": []
    },
    {
      "observation_id": "obs-deepseek-comparison",
      "query_id": "q-brand-comparison",
      "source_type": "direct_engine_observation",
      "status": "observed",
      "engine": {"name": "DeepSeek", "model": null, "web_enabled": false},
      "observed_at": "2026-08-20T16:13:00+08:00",
      "raw_response": "示例回答：对比中客观描述品牌",
      "position": "top3",
      "recommendation": "neutral",
      "citations": null,
      "sentiment": "neutral",
      "coverage": {"intro": true, "selling_points": true, "products": true, "pricing": false, "reputation": null, "news": null},
      "fact_errors": [{"error_id": "error-outdated-product", "description": "包含一处过时产品信息", "severity": "minor"}]
    },
    {
      "observation_id": "obs-doubao-brand",
      "query_id": "q-brand-direct",
      "source_type": "user_provided_observation",
      "status": "observed",
      "engine": {"name": "豆包", "model": null, "web_enabled": null},
      "observed_at": "2026-08-20T16:20:00+08:00",
      "raw_response": "示例回答：品牌直达信息完整",
      "position": "top1",
      "recommendation": "explicit",
      "citations": [],
      "sentiment": "positive",
      "coverage": {"intro": true, "selling_points": true, "products": true, "pricing": true, "reputation": true, "news": false},
      "fact_errors": []
    },
    {
      "observation_id": "obs-doubao-category",
      "query_id": "q-category-recommendation",
      "source_type": "user_provided_observation",
      "status": "observed",
      "engine": {"name": "豆包", "model": null, "web_enabled": null},
      "observed_at": "2026-08-20T16:21:00+08:00",
      "raw_response": "示例回答：品牌进入前五候选",
      "position": "top5",
      "recommendation": "tied",
      "citations": [],
      "sentiment": "positive",
      "coverage": {"intro": true, "selling_points": true, "products": true, "pricing": null, "reputation": true, "news": null},
      "fact_errors": []
    },
    {
      "observation_id": "obs-doubao-solution",
      "query_id": "q-solution",
      "source_type": "user_provided_observation",
      "status": "observed",
      "engine": {"name": "豆包", "model": null, "web_enabled": null},
      "observed_at": "2026-08-20T16:22:00+08:00",
      "raw_response": "示例回答：解决方案中品牌为候选之一",
      "position": "top3",
      "recommendation": "tied",
      "citations": [],
      "sentiment": "positive",
      "coverage": {"intro": true, "selling_points": true, "products": true, "pricing": null, "reputation": null, "news": null},
      "fact_errors": []
    },
    {
      "observation_id": "obs-doubao-comparison",
      "query_id": "q-brand-comparison",
      "source_type": "user_provided_observation",
      "status": "observed",
      "engine": {"name": "豆包", "model": null, "web_enabled": null},
      "observed_at": "2026-08-20T16:23:00+08:00",
      "raw_response": "示例回答：品牌在对比中获得明确推荐",
      "position": "top1",
      "recommendation": "explicit",
      "citations": [],
      "sentiment": "positive",
      "coverage": {"intro": true, "selling_points": true, "products": true, "pricing": true, "reputation": true, "news": null},
      "fact_errors": []
    }
  ]
}
